{
  "schemaVersion": "1.0.0",
  "labId": "LAB-14",
  "runId": "fixture-14",
  "mode": "Deployment",
  "generatedAt": "2026-08-31T10:00:00Z",
  "result": "pass",
  "summary": {
    "required": 10,
    "passed": 10,
    "failed": 0,
    "skipped": 0
  },
  "checks": [
    {
      "id": "lab14-cp01.positive",
      "checkpointId": "LAB14-CP01",
      "kind": "positive",
      "required": true,
      "status": "pass",
      "message": "Fixture expected state observed.",
      "evidence": {
        "command": "fixture positive read-only query",
        "expected": "expected fixture state",
        "actual": "observed fixture state",
        "capturedAt": "2026-08-31T10:00:00Z",
        "redacted": true
      }
    },
    {
      "id": "lab14-cp01.negative",
      "checkpointId": "LAB14-CP01",
      "kind": "negative",
      "required": true,
      "status": "pass",
      "message": "Fixture expected state observed.",
      "evidence": {
        "command": "fixture negative read-only query",
        "expected": "expected fixture state",
        "actual": "observed fixture state",
        "capturedAt": "2026-08-31T10:00:00Z",
        "redacted": true
      }
    },
    {
      "id": "lab14-cp02.positive",
      "checkpointId": "LAB14-CP02",
      "kind": "positive",
      "required": true,
      "status": "pass",
      "message": "Fixture expected state observed.",
      "evidence": {
        "command": "fixture positive read-only query",
        "expected": "expected fixture state",
        "actual": "observed fixture state",
        "capturedAt": "2026-08-31T10:00:00Z",
        "redacted": true
      }
    },
    {
      "id": "lab14-cp02.negative",
      "checkpointId": "LAB14-CP02",
      "kind": "negative",
      "required": true,
      "status": "pass",
      "message": "Fixture expected state observed.",
      "evidence": {
        "command": "fixture negative read-only query",
        "expected": "expected fixture state",
        "actual": "observed fixture state",
        "capturedAt": "2026-08-31T10:00:00Z",
        "redacted": true
      }
    },
    {
      "id": "lab14-cp03.positive",
      "checkpointId": "LAB14-CP03",
      "kind": "positive",
      "required": true,
      "status": "pass",
      "message": "Fixture expected state observed.",
      "evidence": {
        "command": "fixture positive read-only query",
        "expected": "expected fixture state",
        "actual": "observed fixture state",
        "capturedAt": "2026-08-31T10:00:00Z",
        "redacted": true
      }
    },
    {
      "id": "lab14-cp03.negative",
      "checkpointId": "LAB14-CP03",
      "kind": "negative",
      "required": true,
      "status": "pass",
      "message": "Fixture expected state observed.",
      "evidence": {
        "command": "fixture negative read-only query",
        "expected": "expected fixture state",
        "actual": "observed fixture state",
        "capturedAt": "2026-08-31T10:00:00Z",
        "redacted": true
      }
    },
    {
      "id": "lab14-cp04.positive",
      "checkpointId": "LAB14-CP04",
      "kind": "positive",
      "required": true,
      "status": "pass",
      "message": "Fixture expected state observed.",
      "evidence": {
        "command": "fixture positive read-only query",
        "expected": "expected fixture state",
        "actual": "observed fixture state",
        "capturedAt": "2026-08-31T10:00:00Z",
        "redacted": true
      }
    },
    {
      "id": "lab14-cp04.negative",
      "checkpointId": "LAB14-CP04",
      "kind": "negative",
      "required": true,
      "status": "pass",
      "message": "Fixture expected state observed.",
      "evidence": {
        "command": "fixture negative read-only query",
        "expected": "expected fixture state",
        "actual": "observed fixture state",
        "capturedAt": "2026-08-31T10:00:00Z",
        "redacted": true
      }
    },
    {
      "id": "lab14-cp05.positive",
      "checkpointId": "LAB14-CP05",
      "kind": "positive",
      "required": true,
      "status": "pass",
      "message": "Fixture expected state observed.",
      "evidence": {
        "command": "fixture positive read-only query",
        "expected": "expected fixture state",
        "actual": "observed fixture state",
        "capturedAt": "2026-08-31T10:00:00Z",
        "redacted": true
      }
    },
    {
      "id": "lab14-cp05.negative",
      "checkpointId": "LAB14-CP05",
      "kind": "negative",
      "required": true,
      "status": "pass",
      "message": "Fixture expected state observed.",
      "evidence": {
        "command": "fixture negative read-only query",
        "expected": "expected fixture state",
        "actual": "observed fixture state",
        "capturedAt": "2026-08-31T10:00:00Z",
        "redacted": true
      }
    }
  ]
}
